{"assertions":[{"actual":true,"evidence_sha256":["2bef4e2dfd14904a2635aff4b2ba8de6571f00fedfd38f180b747796174920aa"],"evidence_type":"runtime.preflight","expected":true,"explanation":"The deterministic comparison passed.","id":"preflight-complete","operator":"eq","path":"/facts/snapshot_complete","severity":"HARD","status":"PASS"},{"actual":true,"evidence_sha256":["6cc89b89e25007cbb06f91531ee509fd6d049cb6ae0b677e53ec31d7e3eefcb3"],"evidence_type":"browser.session","expected":true,"explanation":"The deterministic comparison passed.","id":"browser-capture-complete","operator":"eq","path":"/facts/capture_complete","severity":"HARD","status":"PASS"},{"actual":true,"evidence_sha256":["6cc89b89e25007cbb06f91531ee509fd6d049cb6ae0b677e53ec31d7e3eefcb3"],"evidence_type":"browser.session","expected":true,"explanation":"The deterministic comparison passed.","id":"browser-steps-pass","operator":"eq","path":"/facts/all_steps_passed","severity":"HARD","status":"PASS"},{"actual":0,"evidence_sha256":["6cc89b89e25007cbb06f91531ee509fd6d049cb6ae0b677e53ec31d7e3eefcb3"],"evidence_type":"browser.session","expected":0,"explanation":"The deterministic comparison passed.","id":"console-errors-zero","operator":"eq","path":"/facts/unexpected_console_error_count","severity":"HARD","status":"PASS"},{"actual":0,"evidence_sha256":["6cc89b89e25007cbb06f91531ee509fd6d049cb6ae0b677e53ec31d7e3eefcb3"],"evidence_type":"browser.session","expected":0,"explanation":"The deterministic comparison passed.","id":"page-errors-zero","operator":"eq","path":"/facts/page_error_count","severity":"HARD","status":"PASS"},{"actual":0,"evidence_sha256":["6cc89b89e25007cbb06f91531ee509fd6d049cb6ae0b677e53ec31d7e3eefcb3"],"evidence_type":"browser.session","expected":0,"explanation":"The deterministic comparison passed.","id":"failed-requests-zero","operator":"eq","path":"/facts/failed_request_count","severity":"HARD","status":"PASS"},{"actual":0,"evidence_sha256":["6cc89b89e25007cbb06f91531ee509fd6d049cb6ae0b677e53ec31d7e3eefcb3"],"evidence_type":"browser.session","expected":0,"explanation":"The deterministic comparison passed.","id":"http-errors-zero","operator":"eq","path":"/facts/unexpected_http_error_count","severity":"HARD","status":"PASS"},{"actual":0,"evidence_sha256":["6cc89b89e25007cbb06f91531ee509fd6d049cb6ae0b677e53ec31d7e3eefcb3"],"evidence_type":"browser.session","expected":0,"explanation":"The deterministic comparison passed.","id":"duplicate-writes-zero","operator":"eq","path":"/facts/duplicate_write_request_group_count","severity":"HARD","status":"PASS"},{"actual":0,"evidence_sha256":["6cc89b89e25007cbb06f91531ee509fd6d049cb6ae0b677e53ec31d7e3eefcb3"],"evidence_type":"browser.session","expected":0,"explanation":"The deterministic comparison passed.","id":"horizontal-overflow-zero","operator":"eq","path":"/facts/horizontal_overflow_viewport_count","severity":"HARD","status":"PASS"},{"actual":2,"evidence_sha256":["6cc89b89e25007cbb06f91531ee509fd6d049cb6ae0b677e53ec31d7e3eefcb3"],"evidence_type":"browser.session","expected":2,"explanation":"The deterministic comparison passed.","id":"viewport-coverage","operator":"eq","path":"/facts/viewport_count","severity":"HARD","status":"PASS"},{"actual":2,"evidence_sha256":["6cc89b89e25007cbb06f91531ee509fd6d049cb6ae0b677e53ec31d7e3eefcb3"],"evidence_type":"browser.session","expected":2,"explanation":"The deterministic comparison passed.","id":"screenshot-coverage","operator":"eq","path":"/facts/screenshot_count","severity":"HARD","status":"PASS"}],"baseline":{"fingerprint":"3333333333333333333333333333333333333333333333333333333333333333","id":"m2-browser-fixture-baseline","status":"VALID","tolerances":{"unexpected_browser_errors":0,"viewport_count":2}},"change_scope":{"consumers":["plan-validator","browser-adapter","artifact-store","verdict-engine","json-report","markdown-report"],"expected_blast_radius":"Plan 0.3, browser.session evidence, attachment manifests, CLI and reports","level":"L2_CONTRACT","owner":"VeriTrail Core / Browser Adapter"},"cleanup_steps":["Close the Playwright browser and every context.","Stop the loopback fixture server and verify port 18765 is released.","Verify no .veritrail-* staging directory remains."],"contamination":[],"created_at":"2026-08-08T23:12:33.906696Z","evidence":[{"attachments":[],"captured_at":"2026-08-08T23:12:31.781359Z","evidence_type":"runtime.preflight","parser_version":"evidence-json/0.1","path":"evidence/001-runtime.preflight-2bef4e2dfd14.json","redacted":false,"redacted_fields":0,"redaction_rule_version":"privacy/0.1","retention":"local-default","sha256":"2bef4e2dfd14904a2635aff4b2ba8de6571f00fedfd38f180b747796174920aa","size":2086,"source":"VeriTrail resource-preflight/0.1","source_name":"generated-preflight.json","summary":{"resource_decision":"PROCEED","snapshot_complete":true}},{"attachments":[{"logical_name":"desktop-ready","media_type":"image/png","path":"attachments/browser/desktop/001-ready.png","sha256":"b14acc19053711225bd6c93c77739cd9a59d91647ccd1babbe82036225e42748","size":33066},{"logical_name":"mobile-ready","media_type":"image/png","path":"attachments/browser/mobile/001-ready.png","sha256":"dbb8683146d05ca3b2ea6d4d0581fe8f87bc9eb4720fd321baddb19b227fa2f0","size":30659}],"captured_at":"2026-08-08T23:12:32.039774Z","evidence_type":"browser.session","parser_version":"evidence-json/0.1","path":"evidence/002-browser.session-6cc89b89e250.json","redacted":false,"redacted_fields":0,"redaction_rule_version":"privacy/0.1","retention":"local-default","sha256":"6cc89b89e25007cbb06f91531ee509fd6d049cb6ae0b677e53ec31d7e3eefcb3","size":6140,"source":"VeriTrail browser-playwright/0.1","source_name":"generated-browser.json"}],"execution_status":"COMPLETED","load_model":{"in_flight_requests":1,"virtual_users":1},"missing_evidence":[],"plan":{"id":"m2-browser-smoke","sha256":"2a16769446e4eb617ab4fdd51b7b1eda9c7266654d5a991106416c9488c91fd7","version":1},"primary_variable":{"name":"fixture_variant","role":"PRIMARY","source":"sealed-plan","value":"healthy"},"random_seed":20260809,"reasons":[{"code":"ALL_DECISIVE_ASSERTIONS_PASSED","message":"All required evidence is present and every decisive assertion passed."}],"reproduction_steps":["Serve examples/browser/site on loopback port 18765.","Run browser-capture with this sealed plan and a unique Run ID.","Verify both viewport timelines, browser facts, screenshots and manifests."],"resource_budget":{"max_artifact_bytes":5242880},"run_id":"m2-freeze-pass","schema_version":"0.1","subject":{"id":"veritrail-browser-fixture","source_ref":"examples/browser/site","version":"healthy-1"},"verdict":"PASS"}
